class,type,name,spellID,omniCDDefault,skillCappedDefaults,OmniBar,OmniBarType,WeakAura,WeakAuraType,castTime,range,cooldown,iconUrl,screenshotUrl,description,descriptionOriginal
HUNTER,cc,Intimidation,19577,1,1,1,Crowd Control,0,,Instant,100 yards,1 minute,wow-hunter-intimidation.png,wow-hunter-intimidation.jpg,"Commands your pet to stun the target for 5 sec. After the stun ends, the target deals 10% less damage to you for 8 sec.","Commands your pet to intimidate the target, stunning it for 5 sec. [Binding Shackles: Targets stunned by Intimidation deal 10% less damage to you for 8 sec after the effect ends]"
HUNTER,interrupt,Muzzle,187707,1,1,1,Interrupts,0,,Instant,5 yards,15 seconds,wow-hunter-muzzle.png,wow-hunter-muzzle.jpg,Interrupts spellcasting and prevents any spell from that school from being cast for 3 sec.,"Interrupts spellcasting, preventing any spell in that school from being cast for 3 sec."
HUNTER,externalDefensive,Roar of Sacrifice,53480,1,1,0,,0,,Instant,40 yards,1 minute,wow-hunter-roar-of-sacrifice.png,wow-hunter-roar-of-sacrifice.jpg,"Instructs your pet to prevent critical strikes against a friendly target for 12 sec, but your pet also takes 10% of all damage received by that target.","Instructs your pet to protect a friendly target from critical strikes, making attacks against that target unable to be critical strikes, but 10% of all damage taken by that target is also taken by the pet. Lasts 12 sec."
HUNTER,cc,Scatter Shot,213691,0,1,0,,0,,Instant,20 yards,30 seconds,wow-hunter-scatter-shot.png,wow-hunter-scatter-shot.jpg,Short-range shot that incapacitates the target for 4 sec and removes all harmful damage over time effects. Any damage caused will remove the effect. Targets incapacitated deal 10% less damage to you for 8 sec after the effect ends.,"A short-range shot that deals (4. 4616% of Attack power) damage, removes all harmful damage over time effects, and incapacitates the target for 4 sec.  Any damage caused will remove the effect. Turns off your attack when used. [Binding Shackles: Targets incapacitated by Scatter Shot deal 10% less damage to you for 8 sec after the effect ends]"
HUNTER,defensive,Survival of the Fittest,264735,1,1,0,,0,,Instant,50000 yards,2 minutes,wow-hunter-survival-of-the-fittest.png,wow-hunter-survival-of-the-fittest.jpg,Reduces all damage you and your pet take by 30% for 6 sec.,Reduces all damage you and your pet take by 30% for 6 sec.
HUNTER,offensive,Trueshot,288613,1,0,0,,1,Offensives,Instant,0 yards,2 minutes,wow-hunter-trueshot.png,wow-hunter-trueshot.jpg,"Reduces Aimed Shot and Rapid Fire cooldown by 70%, makes Aimed Shot cast 50% faster and cost 50% less Focus for 15 sec. While active, you generate 50% additional Focus.","Reduces the cooldown of your Aimed Shot and Rapid Fire by 70%, and causes Aimed Shot to cast 50% faster and cost 50% less Focus for 15 sec. While Trueshot is active, you generate 50% additional Focus [Unerring Vision: and you gain 1% critical strike chance and 2% increased critical damage dealt every 1 sec, stacking up to 10 times] . [Calling the Shots: Every 50 Focus spent reduces the cooldown of Trueshot by 2. 5 sec]"
MAGE,defensive,Alter Time,342245,1,1,0,,0,,Instant,0 yards,1 minute,wow-mage-alter-time.png,wow-mage-alter-time.jpg,"Returns you to your initial location and health when cast again or after 10 sec, unless negated by long distance or death.","Alters the fabric of time, returning you to your current location and health when cast a second time, or after 10 sec. Effect negated by long distance or death."
MAGE,offensive,Arcane Surge,365350,1,0,0,,1,Offensives,2.5 seconds,40 yards,1.5 minutes,wow-mage-arcane-surge.png,wow-mage-arcane-surge.jpg,"Annihilates your target and nearby enemies with Arcane damage based on Mana spent, dealing reduced damage beyond 5 targets. Increases your Mana regeneration by 425% and spell damage by 35% for 15 sec.","Expend all of your current mana to annihilate your enemy target and nearby enemies for up to [(215. 74% of Spell power) * 2] Arcane damage based on Mana spent. Deals reduced damage beyond 5 targets. Generates Clearcasting. For the next 15 sec, your Mana regeneration is increased by 425% and spell damage is increased by 35%."
MAGE,defensive,Cauterize,86949,1,1,0,,0,,Instant,0 yards,,wow-mage-cauterize.png,wow-mage-cauterize.jpg,"Fatal damage instead brings you to 35% health and deals 28% of your maximum health over 6 sec. While burning, movement slowing effects are suppressed and your movement speed is increased by 150%. Can only occur once every 5 min.","Fatal damage instead brings you to 35% health and then burns you for 28% of your maximum health over 6 sec. While burning, movement slowing effects are suppressed and your movement speed is increased by 150%. This effect cannot occur more than once every 5 min."
MAGE,defensive,Cold Snap,235219,1,1,0,,0,,Instant,0 yards,5 minutes,wow-mage-cold-snap.png,wow-mage-cold-snap.jpg,"Resets the cooldown of your Ice Barrier, Frost Nova, Cone of Cold, Ice Cold, and Ice Block.","Resets the cooldown of your Ice Barrier, Frost Nova, Cone of Cold, Ice Cold, and Ice Block."
MAGE,offensive,Combustion,190319,1,0,0,,1,Offensives,Instant,0 yards,2 minutes,wow-mage-combustion.png,wow-mage-combustion.jpg,"Engulfs you in flames for 10 sec, increasing your spells critical strike chance by 100%. Castable while casting other spells.","Engulfs you in flames for 10 sec, increasing your spells' critical strike chance by 100%. Castable while casting other spells."
MAGE,interrupt,Counterspell,2139,1,1,1,Interrupts,0,,Instant,40 yards,24 seconds,wow-mage-counterspell.png,wow-mage-counterspell.jpg,"Silences the enemy, preventing spells from the interrupted school of magic for 5 sec.","Counters the enemy's spellcast, preventing any spell from that school of magic from being cast for 5 sec."
MAGE,aoeCC,Dragon's Breath,31661,0,1,1,Crowd Control,0,,Instant,0 yards,45 seconds,wow-mage-dragon's-breath.png,wow-mage-dragon's-breath.jpg,Enemies in a cone in front of you take Fire damage and are disoriented for 4 sec. Damage will cancel the effect.,Enemies in a cone in front of you take (66. 99% of Spell power) Fire damage and are disoriented for 4 sec. Damage will cancel the effect.
MAGE,immunity,Ice Block,45438,1,1,1,Defensives,0,,Instant,0 yards,4 minutes,wow-mage-ice-block.png,wow-mage-ice-block.jpg,"Encases you in a block of ice, making you immune to all attacks and damage for 10 sec. You cannot attack, move, or cast spells during this time. Causes Hypothermia, preventing recasting for 30 sec.","Encases you in a block of ice, protecting you from all attacks and damage for 10 sec, but during that time you cannot attack, move, or cast spells. Causes Hypothermia, preventing you from recasting Ice Block for 30 sec."
MAGE,defensive,Ice Cold,414658,1,1,0,,0,,Instant,0 yards,4 minutes,wow-mage-ice-cold.png,wow-mage-ice-cold.jpg,"Reduces all damage you take by 70% for 6 sec. Causes Hypothermia, preventing recasting for 30 sec.","Your blood runs cold, reducing all damage you take by 70% for 6 sec. Causes Hypothermia, preventing you from recasting Ice Cold for 30 sec."
MAGE,offensive,Icy Veins,12472,1,0,0,,1,Offensives,Instant,0 yards,2 minutes,wow-mage-icy-veins.png,wow-mage-icy-veins.jpg,"Grants 20% haste for 25 sec and prevents damage from delaying your spellcasts. Summons a water elemental for the duration, which increases your Frost damage by 3% per ability, up to 15%.","Accelerates your spellcasting for 25 sec, granting 20% haste and preventing damage from delaying your spellcasts. Activating Icy Veins summons a water elemental to your side for its duration. The water elemental's abilities grant you Frigid Empowerment, increasing the Frost damage you deal by 3%, up to 15%."
MAGE,offensive,Presence of Mind,205025,0,0,0,,1,Offensives,Instant,0 yards,45 seconds,wow-mage-presence-of-mind.png,wow-mage-presence-of-mind.jpg,Makes your next 2 Arcane Blasts instant cast.,Causes your next 2 Arcane Blasts to be instant cast.
MAGE,dispel,Remove Curse,475,0,1,0,,0,,Instant,40 yards,8 seconds,wow-mage-remove-curse.png,wow-mage-remove-curse.jpg,Removes all Curses from a friendly target.,Removes all Curses from a friendly target.
MAGE,aoeCC,Ring of Frost,113724,1,1,0,,0,,2 seconds,30 yards,45 seconds,wow-mage-ring-of-frost.png,wow-mage-ring-of-frost.jpg,"Summons a Ring of Frost for 10 sec at the target location. Enemies entering the ring are incapacitated for 10 sec, up to 10 targets. When the incapacitate expires, enemies are slowed by 65% for 4 sec.","Summons a Ring of Frost for 10 sec at the target location. Enemies entering the ring are incapacitated for 10 sec. Limit 10 targets. When the incapacitate expires, enemies are slowed by 65% for 4 sec."
MAGE,cc,Snowdrift,389794,0,0,0,,1,Offensives,Instant,0 yards,45 seconds,wow-mage-snowdrift.png,wow-mage-snowdrift.jpg,"Summon a Blizzard around you for 6 sec, slowing enemies by 70% and dealing Frost damage each second. Enemies caught for 2 sec become Frozen and are stunned for 4 sec.","Summon a strong Blizzard that surrounds you for 6 sec that slows enemies by 70% and deals (20% of Spell power) Frost damage every 1 sec. Enemies that are caught in Snowdrift for 2 sec consecutively become Frozen in ice, stunned for 4 sec."
MONK,dispel,Detox,115450,0,1,0,,0,,Instant,40 yards,8 seconds,wow-monk-detox.png,wow-monk-detox.jpg,Removes all Magic effects from the target.,Removes all Magic effects from the target.
MONK,defensive,Diffuse Magic,122783,1,1,1,Defensives,0,,Instant,0 yards,1.5 minutes,wow-monk-diffuse-magic.png,wow-monk-diffuse-magic.jpg,Reduces magic damage taken by 60% for 6 sec and reflects all active harmful magic effects back to their original caster if possible.,"Reduces magic damage you take by 60% for 6 sec, and transfers all currently active harmful magical effects on you back to their original caster if possible."
MONK,defensive,Invoke Niuzao the Black Ox,132578,0,0,0,,1,Offensives,Instant,40 yards,3 minutes,wow-monk-invoke-niuzao-the-black-ox.png,wow-monk-invoke-niuzao-the-black-ox.jpg,"Summons an effigy of Niuzao, the Black Ox for 25 sec. Niuzao attacks your primary target and frequently stomps, damaging all nearby enemies. While active, 25% of damage delayed by Stagger is instead staggered by Niuzao.","Summons an effigy of Niuzao, the Black Ox for 25 sec. Niuzao attacks your primary target, and frequently Stomps, damaging all nearby enemies [Improved Invoke Niuzao, the Black Ox: for (16. 38% of Attack power) plus 0% of Stagger damage you have recently purified / .] While active, 25% of damage delayed by Stagger is instead Staggered by Niuzao."
MONK,aoeCC,Leg Sweep,119381,0,1,1,Crowd Control,0,,Instant,0 yards,1 minute,wow-monk-leg-sweep.png,wow-monk-leg-sweep.jpg,Stuns all enemies within 6 yards for 3 sec.,"Knocks down all enemies within 6 yards, stunning them for 3 sec."
MONK,externalDefensive,Life Cocoon,116849,1,1,1,Defensives,0,,Instant,40 yards,2 minutes,wow-monk-life-cocoon.png,wow-monk-life-cocoon.jpg,"Encases the target in a cocoon for 12 sec, absorbing damage based on 48% of their total health (increased by Versatility) and increasing all healing over time received by 50%.","Encases the target in a cocoon of Chi energy for 12 sec, absorbing [Total health * 48 / 100 * (1 + Versatility)] damage and increasing all healing over time received by 50%."
MONK,cc,Paralysis,115078,1,1,0,,0,,Instant,20 yards,45 seconds,wow-monk-paralysis.png,wow-monk-paralysis.jpg,Incapacitates the target for 1 min. Damage will cancel the effect. Limit 1.,Incapacitates the target for 1 min. Limit 1. Damage will cancel the effect.
MONK,raidDefensive,Restoral,388615,1,1,0,,0,,Instant,0 yards,1 second,wow-monk-restoral.png,wow-monk-restoral.jpg,Heals all party and raid members within 40 yds and clears them of all harmful Poison and Disease effects. Castable while stunned. Healing reduced beyond 5 targets.,Heals all party and raid members within 40 yds for (1497. 07% of Spell power) and clears them of all harmful Poison and Disease effects. Castable while stunned. Healing reduced beyond 5 targets.
MONK,raidDefensive,Revival,115310,1,1,1,Defensives,0,,Instant,0 yards,1 second,wow-monk-revival.png,wow-monk-revival.jpg,"Heals all party and raid members within 40 yds and removes 3 harmful Magic, all Poison, and all Disease effects. Healing is reduced beyond 5 targets.","Heals all party and raid members within 40 yds for (1497. 07% of Spell power) and clears them of 3 harmful Magic, all Poison, and all Disease effects. Healing reduced beyond 5 targets."
MONK,cc,Song of Chi-Ji,198898,1,1,0,,0,,1.8 seconds,40 yards,30 seconds,wow-monk-song-of-chi-ji.png,wow-monk-song-of-chi-ji.jpg,"Creates a cloud of hypnotic mist that travels forward, making enemies touched by it fall asleep and become disoriented for 20 sec.","Conjures a cloud of hypnotic mist that slowly travels forward. Enemies touched by the mist fall asleep, Disoriented for 20 sec."
MONK,interrupt,Spear Hand Strike,116705,1,1,1,Interrupts,0,,Instant,5 yards,15 seconds,wow-monk-spear-hand-strike.png,wow-monk-spear-hand-strike.jpg,Interrupts the targets spellcasting and prevents any spell from that school of magic from being cast for 3 sec.,"Jabs the target in the throat, interrupting spellcasting and preventing any spell from that school of magic from being cast for 3 sec."
MONK,offensive,Storm Earth and Fire,137639,1,0,0,,1,Offensives,Instant,0 yards,1.5 minutes,wow-monk-storm-earth-and-fire.png,wow-monk-storm-earth-and-fire.jpg,"Split into 3 elemental spirits for 15 sec, each dealing 40% of normal damage and healing. You control the Storm spirit, while Earth and Fire spirits attack nearby enemies. Recasting will make spirits focus on your target.","Split into 3 elemental spirits for 15 sec, each spirit dealing 40% of normal damage and healing. You directly control the Storm spirit, while Earth and Fire spirits mimic your attacks on nearby enemies. While active, casting Storm, Earth, and Fire again will cause the spirits to fixate on your target."
MONK,freedom,Tiger's Lust,116841,1,1,0,,0,,Instant,20 yards,30 seconds,wow-monk-tiger's-lust.png,wow-monk-tiger's-lust.jpg,Increases a friendly targets movement speed by 70% for 6 sec and removes all roots and snares.,Increases a friendly target's movement speed by 70% for 6 sec and removes all roots and snares.
MONK,defensive,Touch of Karma,122470,1,1,1,Defensives,0,,Instant,20 yards,1.5 minutes,wow-monk-touch-of-karma.png,wow-monk-touch-of-karma.jpg,"Absorbs all damage taken for 10 sec, up to 50% of your maximum health, and redirects 70% of it as Nature damage to the enemy over 6 sec.","Absorbs all damage taken for 10 sec, up to 50% of your maximum health, and redirects 70% of that amount to the enemy target as Nature damage over 6 sec."
MONK,movement,Transcendence: Transfer,119996,1,1,0,,0,,Instant,40 yards,45 seconds,wow-monk-transcendence-transfer.png,wow-monk-transcendence-transfer.jpg,Swaps your body and spirit locations.,Your body and spirit swap locations.
MONK,offensive,Weapons of Order,387184,0,0,0,,1,Offensives,Instant,0 yards,2 minutes,wow-monk-weapons-of-order.png,wow-monk-weapons-of-order.jpg,"For Brewmaster: Increases your Mastery by 8.8% for 30 sec. Keg Smash cooldown is reset instantly, and enemies hit by Keg Smash or Rising Sun Kick take 8% more damage from you for 10 sec, stacking up to 4 times. |  | For Windwalker and Mistweaver: Increases your Mastery by 17.25% for 30 sec.","Brewmaster For the next 30 sec, your Mastery is increased by 8. 8%. Additionally, Keg Smash cooldown is reset instantly and enemies hit by Keg Smash or Rising Sun Kick take 8% increased damage from you for 10 sec, stacking up to 4 times.   Windwalker,  Mistweaver For the next 30 sec, your Mastery is increased by 17. 25%. Additionally,"
PALADIN,interrupt,Avenger's Shield,31935,0,0,1,Interrupts,0,,Instant,30 yards,15 seconds,wow-paladin-avenger's-shield.png,wow-paladin-avenger's-shield.jpg,"Hurls your shield at an enemy, dealing Holy damage, interrupting and silencing the target for 3 sec, then jumps to 2 additional enemies.","Hurls your shield at an enemy target, dealing (75. 3523% of Attack power) Holy damage, interrupting and silencing the non-Player target for 3 sec, and then jumping to 2 additional nearby enemies."
PALADIN,heal,Avenging Crusader,216331,1,0,0,,1,Offensives,Instant,0 yards,1 minute,wow-paladin-avenging-crusader.png,wow-paladin-avenging-crusader.jpg,"You become the ultimate crusader of light for 15 sec. Crusader Strike and Judgment cool down 30% faster and heal up to 5 injured allies within 40 yds for 260% of the damage dealt, divided evenly. Grants an additional charge of Crusader Strike for its duration.","You become the ultimate crusader of light for 15 sec. Crusader Strike and Judgment cool down 30% faster and heal up to 5 injured allies within 40 yds for 260% of the damage done, split evenly among them. Grants an additional charge of Crusader Strike for its duration."
PALADIN,offensive,Avenging Wrath,31884,1,0,0,,1,Offensives,Instant,0 yards,2 minutes,wow-paladin-avenging-wrath.png,wow-paladin-avenging-wrath.jpg,"Call upon the Light to become an avatar of retribution, increasing your damage, healing, and critical strike chance by 20% for 20 sec. Judgment generates 1 additional Holy Power, each Holy Power spent causes you to deal damage to nearby enemies, reduces Holy Shocks cooldown by 50%, and allows Hammer of Wrath to be used on any target.","Call upon the Light to become an avatar of retribution, [causing Judgment to generate 1 additional Holy Power,] [each Holy Power spent causing you to explode with Holy light for (13. 5% of Attack power) damage to nearby enemies,] [reducing Holy Shock's cooldown by 50%,] [Hammer of Wrath: allowing Hammer of Wrath to be used on any target] increasing your damage, healing, and critical strike chance by 20% for 20 sec."
PALADIN,heal,Avenging Wrath,384376,1,1,0,,0,,Instant,0 yards,2 minutes,wow-paladin-avenging-wrath.png,wow-paladin-avenging-wrath.jpg,"Call upon the Light to increase your damage and healing done for 20 sec, allowing Hammer of Wrath to be cast on any target. Combines with other Avenging Wrath abilities, granting all known Avenging Wrath effects while active.","Retribution (Retribution Paladin) Call upon the Light and become an avatar of retribution, increasing your damage and healing done by 0% for 20 sec, and allowing Hammer of Wrath to be cast on any target. Combines with other Avenging Wrath abilities, granting all known Avenging Wrath effects while active. ProtectionCall upon the Light and become an avatar of retribution, increasing your damage and healing done by 0% for 20 sec, and allowing Hammer of Wrath to be cast on any target. Combines with other Avenging Wrath abilities, granting all known Avenging Wrath effects while active."
PALADIN,freedom,Blessing of Freedom,1044,1,1,0,,0,,Instant,40 yards,1.5 seconds,wow-paladin-blessing-of-freedom.png,wow-paladin-blessing-of-freedom.jpg,Grants a party or raid member immunity to movement impairing effects and increases movement speed by 30% for 8 sec.,"Blesses a party or raid member, granting immunity to movement impairing effects [Unbound Freedom: and increasing movement speed by 30%] for 8 sec."
PALADIN,externalDefensive,Blessing of Protection,1022,1,1,1,Defensives,0,,Instant,40 yards,1.5 seconds,wow-paladin-blessing-of-protection.png,wow-paladin-blessing-of-protection.jpg,Grants immunity to Physical damage and harmful effects for 10 sec to a party or raid member. Cannot be used on a target with Forbearance. Causes Forbearance for 30 sec. Shares a cooldown with Blessing of Spellwarding.,"Holy, RetributionBlesses a party or raid member, granting immunity to Physical damage and harmful effects for 10 sec. Cannot be used on a target with Forbearance. Causes Forbearance for 30 sec. ProtectionBlesses a party or raid member, granting immunity to Physical damage and harmful effects for 10 sec. Cannot be used on a target with Forbearance. Causes Forbearance for 30 sec. Shares a cooldown with Blessing of Spellwarding."
PALADIN,externalDefensive,Blessing of Sacrifice,6940,1,1,1,Defensives,0,,Instant,40 yards,2 minutes,wow-paladin-blessing-of-sacrifice.png,wow-paladin-blessing-of-sacrifice.jpg,"Blesses an ally, reducing their damage taken by 30% for 12 sec. You take the reduced damage unless it would lower your health below 20%.","Blesses a party or raid member, reducing their damage taken by 30%, but you suffer 100% of damage prevented. Last 12 sec, or until transferred damage would cause you to fall below 20% health."
PALADIN,counterCC,Blessing of Sanctuary,210256,1,1,0,,0,,Instant,40 yards,45 seconds,wow-paladin-blessing-of-sanctuary.png,wow-paladin-blessing-of-sanctuary.jpg,"Removes all stun, silence, fear, and horror effects from a friendly target and reduces the duration of future such effects by 60% for 5 sec.","Instantly removes all stun, silence, fear and horror effects from the friendly target and reduces the duration of future such effects by 60% for 5 sec."
PALADIN,externalDefensive,Blessing of Spellwarding,204018,1,1,1,Defensives,0,,Instant,40 yards,1.5 seconds,wow-paladin-blessing-of-spellwarding.png,wow-paladin-blessing-of-spellwarding.jpg,Grants a party or raid member immunity to magical damage and harmful effects for 10 sec. Cannot be used on targets with Forbearance and causes Forbearance for 30 sec. Shares a cooldown with Blessing of Protection.,"Blesses a party or raid member, granting immunity to magical damage and harmful effects for 10 sec. Cannot be used on a target with Forbearance. Causes Forbearance for 30 sec. Shares a cooldown with Blessing of Protection."
PALADIN,aoeCC,Blinding Light,115750,1,1,0,,0,,Instant,0 yards,1.5 minutes,wow-paladin-blinding-light.png,wow-paladin-blinding-light.jpg,"Blinds enemies within 10 yds, causing them to wander disoriented for 6 sec.","Emits dazzling light in all directions, blinding enemies within 10 yds, causing them to wander disoriented for 6 sec."
PALADIN,dispel,Cleanse,4987,0,1,0,,0,,Instant,40 yards,8 seconds,wow-paladin-cleanse.png,wow-paladin-cleanse.jpg,"Removes all Poison, Disease, and Magic effects from a friendly target.","Cleanses a friendly target, removing all [Improved Cleanse: Poison, Disease, and] Magic effects."
PALADIN,offensive,Crusade,231895,1,0,0,,1,Offensives,Instant,0 yards,2 minutes,wow-paladin-crusade.png,wow-paladin-crusade.jpg,"Call upon the Light to begin a crusade for 27 sec, increasing your haste and damage by 3%. Each Holy Power spent during Crusade increases haste and damage by an additional 3%, up to 10 stacks. Hammer of Wrath can be cast on any target.","Call upon the Light and begin a crusade, increasing your haste [Retribution: and damage] by 3% for 27 sec. Each Holy Power spent during Crusade increases haste and damage by an additional 3%. Maximum 10 stacks. [Sanctified Wrath: While active, each Holy Power spent causes you to explode with Holy light for (13. 5% of Attack power) damage to nearby enemies] [Retribution: Hammer of Wrath may be cast on any target]"
PALADIN,defensive,Divine Protection,403876,1,1,0,,0,,Instant,0 yards,1 minute,wow-paladin-divine-protection.png,wow-paladin-divine-protection.jpg,Reduces all damage you take by 20% for 8 sec. Can be used while stunned.,Reduces all damage you take by 20% for 8 sec. Usable while stunned.
PALADIN,defensive,Divine Protection,498,1,1,0,,0,,Instant,0 yards,1 minute,wow-paladin-divine-protection.png,wow-paladin-divine-protection.jpg,Reduces all damage you take by 20% for 8 sec. Can be used while stunned.,Reduces all damage you take by 20% for 8 sec. Usable while stunned.
PALADIN,immunity,Divine Shield,642,1,1,1,Defensives,0,,Instant,0 yards,5 minutes,wow-paladin-divine-shield.png,wow-paladin-divine-shield.jpg,"Grants immunity to all damage, harmful effects, knockbacks, and forced movement for 8 sec. Cannot be used during Forbearance and causes Forbearance for 30 sec.","Grants immunity to all damage, harmful effects, knockbacks and forced movement effects for 8 sec. Cannot be used if you have Forbearance. Causes Forbearance for 30 sec."
PALADIN,cc,Hammer of Justice,853,1,1,1,Crowd Control,0,,Instant,10 yards,45 seconds,wow-paladin-hammer-of-justice.png,wow-paladin-hammer-of-justice.jpg,Stuns an enemy for 6 sec.,Stuns the target for 6 sec.
PALADIN,heal,Lay on Hands,633,1,1,0,,0,,Instant,40 yards,10 minutes,wow-paladin-lay-on-hands.png,wow-paladin-lay-on-hands.jpg,Heals a friendly target for an amount equal to your maximum health. Cannot be used on a target with Forbearance and causes Forbearance for 30 sec.,Heals a friendly target for an amount equal to 100% your maximum health. Cannot be used on a target with Forbearance. Causes Forbearance for 30 sec.
PALADIN,interrupt,Rebuke,96231,1,1,1,Interrupts,0,,Instant,5 yards,15 seconds,wow-paladin-rebuke.png,wow-paladin-rebuke.jpg,Interrupts spellcasting and prevents any spell in that school from being cast for 3 sec.,Interrupts spellcasting and prevents any spell in that school from being cast for 3 sec.
PALADIN,defensive,Shield of Vengeance,184662,1,1,0,,0,,Instant,0 yards,1.5 minutes,wow-paladin-shield-of-vengeance.png,wow-paladin-shield-of-vengeance.jpg,"Creates a barrier of holy light that absorbs damage based on 30% of total health (increased by Versatility) for 10 sec. When the shield expires, it deals Holy damage equal to the absorbed amount, divided among all nearby enemies.","Creates a barrier of holy light that absorbs [30 / 100 * Total health * (1 + Versatility)] damage for 10 sec. When the shield expires, it bursts to inflict Holy damage equal to the total amount absorbed, divided among all nearby enemies."
