class,type,name,spellID,omniCDDefault,skillCappedDefaults,OmniBar,OmniBarType,WeakAura,WeakAuraType,castTime,range,cooldown,iconUrl,screenshotUrl,description,descriptionOriginal
SHAMAN,counterCC,Tremor Totem,8143,1,1,0,,0,,Instant,0 yards,1 minute,wow-shaman-tremor-totem.png,wow-shaman-tremor-totem.jpg,"Summons a totem that removes Fear, Charm, and Sleep effects from party and raid members within 30 yards for 10 sec.","Summons a totem at your feet that shakes the ground around it for 10 sec, removing Fear, Charm and Sleep effects from party and raid members within 30 yards."
SHAMAN,interrupt,Wind Shear,57994,1,1,1,Interrupts,0,,Instant,30 yards,12 seconds,wow-shaman-wind-shear.png,wow-shaman-wind-shear.jpg,Interrupts targets spellcasting and prevents spells in that school for 2 sec.,"Disrupts the target's concentration with a burst of wind, interrupting spellcasting and preventing any spell in that school from being cast for 2 sec."
WARLOCK,offensive,Amplify Curse,328774,0,0,0,,1,Offensives,Instant,0 yards,1 minute,wow-warlock-amplify-curse.png,wow-warlock-amplify-curse.jpg,"Your next Curse of Exhaustion, Curse of Tongues, or Curse of Weakness within 15 sec is enhanced. Curse of Exhaustion reduces the targets movement speed by an additional 20%. Curse of Tongues increases casting time by an additional 40%. Curse of Weakness prevents the enemy from critically striking.","Your next Curse of Exhaustion, Curse of Tongues or Curse of Weakness cast within 15 sec is amplified. Curse of ExhaustionReduces the target's movement speed by an additional 20%. Curse of TonguesIncreases casting time by an additional 40%. Curse of WeaknessEnemy is unable to critically strike."
WARLOCK,interrupt,Command Demon,119898,1,1,1,Interrupts,0,,Instant,0 yards,,wow-warlock-command-demon.png,wow-warlock-command-demon.jpg,"Commands your demon to use its most powerful ability, which varies based on the active pet.",Commands your demon to perform its most powerful ability. This spell will transform based on your active pet. [Demonology: Felguard: Axe Toss] Felhunter: Spell LockVoidwalker: Shadow BulwarkIncubus/Succubus: SeductionImp: Singe Magic
WARLOCK,defensive,Dark Pact,108416,1,1,1,Defensives,0,,Instant,0 yards,1 minute,wow-warlock-dark-pact.png,wow-warlock-dark-pact.jpg,Sacrifices 20% of your current health to shield you for 200% of the sacrificed health plus additional shield based on your Spell power for 20 sec. Usable during control impairing effects.,Sacrifices 20% of your current health to shield you for 200% of the sacrificed health plus an additional (Spell power * 2. 5) for 20 sec. Usable while suffering from control impairing effects.
WARLOCK,movement,Demonic Circle: Teleport,48020,1,1,1,Defensives,0,,Instant,40 yards,30 seconds,wow-warlock-demonic-circle-teleport.png,wow-warlock-demonic-circle-teleport.jpg,Teleports you to your Demonic Circle and removes all movement slowing effects.,Teleports you to your Demonic Circle and removes all movement slowing effects.
WARLOCK,heal,Demonic Healthstone,452930,0,1,1,Defensives,0,,Instant,0 yards,1 minute,wow-warlock-demonic-healthstone.png,wow-warlock-demonic-healthstone.jpg,"Instantly restores 25% health, plus an additional 30% over 6 sec.",Instantly restores 25% health [Empowered Healthstone: plus an additional 30% over 6 sec / .]
WARLOCK,interrupt,Grimoire: Felguard,111898,1,1,0,,0,,Instant,40 yards,2 minutes,wow-warlock-grimoire-felguard.png,wow-warlock-grimoire-felguard.jpg,"Summons a Felguard to attack your target for 17 sec, dealing 125% increased damage, and stunning and interrupting the target upon being summoned.",Summons a Felguard who attacks the target for 17 sec that deals 125% increased damage. This Felguard will stun and interrupt their target when summoned.
WARLOCK,aoeCC,Howl of Terror,5484,1,1,1,Crowd Control,0,,Instant,0 yards,40 seconds,wow-warlock-howl-of-terror.png,wow-warlock-howl-of-terror.jpg,"Causes 5 enemies within 10 yards to flee in fear, disorienting them for 20 sec. Damage may cancel the effect.","Let loose a terrifying howl, causing 5 enemies within 10 yds to flee in fear, disorienting them for 20 sec. Damage may cancel the effect."
WARLOCK,offensive,Malevolence,442726,0,0,0,,1,Offensives,Instant,0 yards,1 minute,wow-warlock-malevolence.png,wow-warlock-malevolence.jpg,"Dark magic erupts from you, affecting enemies with your Wither to take Shadowflame damage and increase its stack count by 6 for 20 sec. While corrupted, your Haste is increased by 8%, and spending Soul Shards on damaging spells grants 1 additional stack of Wither.","Dark magic erupts from you and corrupts your soul for 20 sec, causing enemies suffering from your Wither to take (333. 029% of Spell power) Shadowflame damage and increase its stack count by 6. While corrupted your Haste is increased by 8% and spending Soul Shards on damaging spells grants 1 additional stack of Wither."
WARLOCK,cc,Mortal Coil,6789,1,1,1,Crowd Control,0,,Instant,20 yards,45 seconds,wow-warlock-mortal-coil.png,wow-warlock-mortal-coil.jpg,Incapacitating an enemy for 3 sec and healing you for 20% of your maximum health.,"Horrifies an enemy target into fleeing, incapacitating for 3 sec and healing you for 20% of maximum health."
WARLOCK,offensive,Summon Demonic Tyrant,265187,1,0,0,,1,Offensives,2 seconds,40 yards,1 minute,wow-warlock-summon-demonic-tyrant.png,wow-warlock-summon-demonic-tyrant.jpg,"Summon a Demonic Tyrant to increase the duration of your Dreadstalkers, Vilefiend, Felguard, and up to 10 Wild Imps by 15 sec and increase their damage by 15% while damaging your target.","Summon a Demonic Tyrant to increase the duration of your Dreadstalkers, Vilefiend, Felguard, and up to 10 of your Wild Imps by 15 sec. Your Demonic Tyrant increases the damage of affected demons by 15%, while damaging your target. [Soulbound Tyrant: Generates 0 Soul Shards.]"
WARLOCK,defensive,Unending Resolve,104773,1,1,1,Defensives,0,,Instant,0 yards,3 minutes,wow-warlock-unending-resolve.png,wow-warlock-unending-resolve.jpg,"Reduces all damage you take by 25% and grants immunity to interrupt, silence, and pushback effects for 8 sec.","Hardens your skin, reducing all damage you take by 25% and granting immunity to interrupt, silence, and pushback effects for 8 sec."
WARRIOR,offensive,Avatar,107574,1,0,0,,1,Offensives,Instant,0 yards,1.5 minutes,wow-warrior-avatar.png,wow-warrior-avatar.jpg,"Transform into a colossus for 20 sec, dealing 20% increased damage and removing all roots and snares.","Transform into a colossus for 20 sec, causing you to deal 20% increased damage and removing all roots and snares. Generates 10 Rage."
WARRIOR,counterCC,Berserker Shout,384100,1,1,0,,0,,Instant,0 yards,1 minute,wow-warrior-berserker-shout.png,wow-warrior-berserker-shout.jpg,"Go berserk, removing and granting immunity to Fear, Sap, and Incapacitate effects for 6 sec. Also removes fear effects from group members within 12 yds.","Go berserk, removing and granting immunity to Fear, Sap, and Incapacitate effects for 6 sec. Also remove fear effects from group members within 12 yds."
WARRIOR,offensive,Colossus Smash,167105,0,0,0,,1,Offensives,Instant,5 yards,45 seconds,wow-warrior-colossus-smash.png,wow-warrior-colossus-smash.jpg,Deals Physical damage and increases damage you deal to the enemy by 30% for 10 sec.,"Smashes the enemy's armor, dealing (306. 263% of Attack power) Physical damage, and increasing damage you deal to them by 30% for 10 sec."
WARRIOR,defensive,Die by the Sword,118038,1,1,1,Defensives,0,,Instant,0 yards,2 minutes,wow-warrior-die-by-the-sword.png,wow-warrior-die-by-the-sword.jpg,Increases your parry chance by 100% and reduces all damage taken by 30% for 8 sec.,Increases your parry chance by 100% and reduces all damage you take by 30% for 8 sec.
WARRIOR,defensive,Enraged Regeneration,184364,1,1,1,Defensives,0,,Instant,0 yards,2 minutes,wow-warrior-enraged-regeneration.png,wow-warrior-enraged-regeneration.jpg,Reduces damage taken by 30% and Bloodthirst restores an additional 20% health. Can be used while stunned or incapacitated. Lasts 8 sec.,"Reduces damage taken by 30%, and Bloodthirst restores an additional 20% health. Usable while stunned or incapacitated. Lasts 8 sec."
WARRIOR,counterCC,Intervene,3411,0,1,1,Defensives,0,,Instant,25 yards,1.5 seconds,wow-warrior-intervene.png,wow-warrior-intervene.jpg,"Rush to an ally, intercepting all melee and ranged attacks against them for 6 sec while within 10 yds.","Run at high speed toward an ally, intercepting all melee and ranged attacks against them for 6 sec while they remain within 10 yds."
WARRIOR,aoeCC,Intimidating Shout,5246,1,1,1,Crowd Control,0,,Instant,8 yards,1.5 minutes,wow-warrior-intimidating-shout.png,wow-warrior-intimidating-shout.jpg,"Causes the targeted enemy to cower in fear, and up to 5 additional enemies within 8 yards to flee. Targets are disoriented for 8 sec.","[Menace: Causes the targeted enemy and up to 5 additional enemies within 8 yards to cower in fear / Causes the targeted enemy to cower in fear, and up to 5 additional enemies within 8 yards to flee.] Targets are disoriented for 8 sec."
WARRIOR,interrupt,Pummel,6552,1,1,1,Interrupts,0,,Instant,5 yards,15 seconds,wow-warrior-pummel.png,wow-warrior-pummel.jpg,Interrupts the targets spellcasting and locks them out of that school for 3 sec.,"Pummels the target, interrupting spellcasting and preventing any spell in that school from being cast for 3 sec."
WARRIOR,raidDefensive,Rallying Cry,97462,1,1,1,Defensives,0,,Instant,0 yards,3 minutes,wow-warrior-rallying-cry.png,wow-warrior-rallying-cry.jpg,Gives all party or raid members within 40 yards 10% increased maximum health for 10 sec.,"Lets loose a rallying cry, granting all party or raid members within 40 yards 10% temporary and maximum health for 10 sec."
WARRIOR,offensive,Recklessness,1719,1,0,0,,1,Offensives,Instant,0 yards,1.5 minutes,wow-warrior-recklessness.png,wow-warrior-recklessness.jpg,"Go berserk, doubling all Rage generation and increasing your abilities critical strike chance by 20% for 12 sec.","Go berserk, increasing all Rage generation by 100% and granting your abilities 20% increased critical strike chance for 12 sec."
WARRIOR,aoeCC,Shockwave,46968,0,1,0,,0,,Instant,0 yards,40 seconds,wow-warrior-shockwave.png,wow-warrior-shockwave.jpg,"Sends a wave of force in a frontal cone, dealing damage and stunning all enemies within 10 yards for 2 sec.","Sends a wave of force in a frontal cone, causing (20% of Attack power) damage and stunning all enemies within 10 yards for 2 sec."
WARRIOR,cc,Storm Bolt,107570,1,1,1,Crowd Control,0,,Instant,20 yards,30 seconds,wow-warrior-storm-bolt.png,wow-warrior-storm-bolt.jpg,"Hurls your weapon at an enemy, causing Physical damage and stunning for 4 sec. Also hits 2 additional nearby targets, stunning for 2 sec.","Hurls your weapon at an enemy, causing (28. 5% of Attack power) Physical damage and stunning for 4 sec. [Storm Bolts: Also hits 2 additional nearby targets, stunning for 2 sec]"
WARRIOR,offensive,Thunderous Roar,384318,0,0,0,,1,Offensives,Instant,0 yards,1.5 minutes,wow-warrior-thunderous-roar.png,wow-warrior-thunderous-roar.jpg,"Explosively roars, dealing Physical damage to enemies within 12 yards and causing them to bleed for additional damage over 8 sec. Deals reduced damage beyond 5 targets.","Roar explosively, dealing (250. 56% of Attack power) Physical damage to enemies within 12 yds and cause them to bleed for (250. 56% of Attack power) physical damage over 8 sec. Deals reduced damage beyond 5 targets."
WARRIOR,counterCC,War Banner,236320,0,1,0,,0,,Instant,0 yards,1.5 minutes,wow-warrior-war-banner.png,wow-warrior-war-banner.jpg,"Throw down a war banner, increasing movement speed by 30% and reducing the duration of incoming crowd control effects by 50% for all allies within 30 yards. Lasts 15 sec.","You throw down a war banner at your feet, rallying your allies. Increases movement speed by 30% and reduces the duration of all incoming crowd control effects by 50% to all allies within 30 yards of the war banner. Lasts 15 sec."