class,type,name,spellID,omniCDDefault,skillCappedDefaults,OmniBar,OmniBarType,WeakAura,WeakAuraType,castTime,range,cooldown,iconUrl,screenshotUrl,description,descriptionOriginal
PALADIN,externalDefensive,Ultimate Sacrifice,199448,1,1,0,,0,,Instant,40 yards,2 minutes,wow-paladin-ultimate-sacrifice.png,wow-paladin-ultimate-sacrifice.jpg,Transfers 100% of damage taken by a party or raid member to you over 6 sec.,"Places a Blessing on a party or raid member, transferring 100% of damage taken to you over 6 sec."
PRIEST,offensive,Dark Archangel,197871,0,0,0,,1,Offensives,Instant,0 yards,1 minute,wow-priest-dark-archangel.png,wow-priest-dark-archangel.jpg,Increases your damage and the damage of all allies with your Atonement by 15% for 8 sec.,"Increases your damage, and the damage of all allies with your Atonement by 15% for 8 sec."
PRIEST,offensive,Dark Ascension,391109,1,0,0,,1,Offensives,1.5 seconds,0 yards,1 minute,wow-priest-dark-ascension.png,wow-priest-dark-ascension.jpg,Increases your non-periodic Shadow damage by 20% for 20 sec.,Increases your non-periodic Shadow damage by 20% for 20 sec. Generates 30 Insanity.
PRIEST,defensive,Dispersion,47585,1,1,1,Defensives,0,,Instant,0 yards,2 minutes,wow-priest-dispersion.png,wow-priest-dispersion.jpg,"You disperse into shadow, reducing all damage taken by 75% for 6 sec and healing 25% of your maximum health over the duration. You cannot attack or cast spells. Increases movement speed by 50% and makes you immune to movement impairing effects. Can be cast while stunned, feared, or silenced.","Disperse into pure shadow energy, reducing all damage taken by 75% for 6 sec and healing you for [(25 + 0) * (0 + 6) / 6] 25% of your maximum health over its duration, but you are unable to attack or cast spells. Increases movement speed by 50% and makes you immune to all movement impairing effects. Castable while stunned, feared, or silenced."
PRIEST,defensive,Divine Ascension,328530,0,1,0,,0,,Instant,0 yards,1 minute,wow-priest-divine-ascension.png,wow-priest-divine-ascension.jpg,"You ascend into the air, increasing your spell range by 50% but can only cast Holy spells.","You ascend into the air out of harm's way. While floating, your spell range is increased by 50%, but you are only able to cast Holy spells."
PRIEST,externalDefensive,Guardian Spirit,47788,1,1,1,Defensives,0,,Instant,40 yards,3 minutes,wow-priest-guardian-spirit.png,wow-priest-guardian-spirit.jpg,"Summons a guardian spirit to watch over a friendly target for 10 sec, increasing healing received by 60%. If the target would die, the Spirit restores the target to 40% health. Castable while stunned. Cannot prevent death from massive damage.","Calls upon a guardian spirit to watch over the friendly target for 10 sec, increasing healing received by 60%. If the target would die, the Spirit sacrifices itself and restores the target to 40% health. Castable while stunned. Cannot save the target from massive damage."
PRIEST,cc,Holy Word: Chastise,88625,1,1,0,,0,,Instant,30 yards,1 minute,wow-priest-holy-word-chastise.png,wow-priest-holy-word-chastise.jpg,Deals Holy damage and stuns/incapacitates the target for 4 sec. Cooldown is reduced by 4 sec when you cast Smite.,Chastises the target for (385. 749% of Spell power) Holy damage and [Censure: stuns / incapacitates] them for [Censure: 4 sec / 4 sec] . [Holy (Level 26) : Cooldown reduced by 4 sec when you cast Smite.]
PRIEST,movement,Leap of Faith,73325,1,1,0,,0,,Instant,40 yards,1 second,wow-priest-leap-of-faith.png,wow-priest-leap-of-faith.jpg,Instantly moves a party or raid member to a location directly in front of you.,"Pulls the spirit of a party or raid member, instantly moving them directly in front of you."
PRIEST,dispel,Mass Dispel,32375,1,1,0,,0,,1.5 seconds,30 yards,2 minutes,wow-priest-mass-dispel.png,wow-priest-mass-dispel.jpg,Dispels all harmful Magic from 5 friendly targets and 1 beneficial Magic effect from 5 enemy targets within a 15-yard radius. Can remove normally undispellable Magic.,"Dispels magic in a 15 yard radius, removing all harmful Magic from 5 friendly targets and 1 beneficial Magic effects from 5 enemy targets. Potent enough to remove Magic that is normally undispellable."
PRIEST,externalDefensive,Pain Suppression,33206,1,1,1,Defensives,0,,Instant,40 yards,1.5 seconds,wow-priest-pain-suppression.png,wow-priest-pain-suppression.jpg,Reduces all damage taken by a friendly target by 40% for 8 sec. Can be cast while stunned.,Reduces all damage taken by a friendly target by 40% for 8 sec. Castable while stunned.
PRIEST,counterCC,Phase Shift,408558,0,0,0,,1,Offensives,Instant,0 yards,30 second,wow-priest-phase-shift.png,wow-priest-phase-shift.jpg,Avoids all attacks and spells for 1 sec when you cast Fade. Interrupt effects are not prevented by this spell.,"Step into the shadows when you cast Fade, avoiding all attacks and spells for 1 sec. Interrupt effects are not affected by Phase Shift."
PRIEST,offensive,Power Infusion,10060,1,1,0,,1,Offensives,Instant,40 yards,2 minutes,wow-priest-power-infusion.png,wow-priest-power-infusion.jpg,Increases a players haste by 20% for 15 sec.,"Infuses the target with power for 15 sec, increasing haste by 20%. Can only be cast on players."
PRIEST,cc,Psychic Horror,64044,1,1,1,Crowd Control,0,,Instant,30 yards,45 seconds,wow-priest-psychic-horror.png,wow-priest-psychic-horror.jpg,Stuns the target for 4 sec.,"Terrifies the target in place, stunning them for 4 sec."
PRIEST,aoeCC,Psychic Scream,8122,1,1,1,Crowd Control,0,,Instant,0 yards,45 seconds,wow-priest-psychic-scream.png,wow-priest-psychic-scream.jpg,"Causes all enemies within 8 yards to flee, disorienting them for 8 sec. Damage may interrupt the effect.","Lets out a psychic scream, causing all enemies within 8 yards to flee, disorienting them for 8 sec. Damage may interrupt the effect."
PRIEST,dispel,Purify,527,0,1,0,,0,,Instant,40 yards,8 seconds,wow-priest-purify.png,wow-priest-purify.jpg,"Removes all Magic [and Disease, if Improved Purify is learnt] effects from the target.","Dispels harmful effects on the target, removing all Magic [Improved Purify: and Disease] effects."
PRIEST,heal,Rapture,47536,1,1,0,,0,,Instant,40 yards,1.5 minutes,wow-priest-rapture.png,wow-priest-rapture.jpg,Immediately shields your target and your next 3 Power Word: Shields have no cooldown and absorb 80% additional damage.,"Immediately Power Word: Shield your target, and your next 3 Power Word: Shields have no cooldown and absorb 80% additional damage."
PRIEST,externalDefensive,Ray of Hope,197268,1,1,0,,0,,Instant,40 yards,1.5 minutes,wow-priest-ray-of-hope.png,wow-priest-ray-of-hope.jpg,Delays all damage and healing dealt to the target for 6 sec. All healing delayed is increased by 50%.,"For the next 6 sec, all damage and healing dealt to the target is delayed until Ray of Hope ends. All healing that is delayed by Ray of Hope is increased by 50%."
PRIEST,defensive,Restitution,391124,1,1,0,,0,,Instant,0 yards,,wow-priest-restitution.png,wow-priest-restitution.jpg,"After Spirit of Redemption ends, you revive with health based on the healing done during its duration, up to 100%. You cannot benefit from Spirit of Redemption again for 10 min.","After Spirit of Redemption expires, you will revive at up to 100% health, based on your healing done during Spirit of Redemption. After reviving, you cannot benefit from Spirit of Redemption for 10 min."
PRIEST,interrupt,Silence,15487,1,1,1,Crowd Control,0,,Instant,40 yards,45 seconds,wow-priest-silence.png,wow-priest-silence.jpg,"Silences the target, preventing them from casting spells for 4 sec. For non-players, also interrupts and locks the spell school for 4 sec.","Silences the target, preventing them from casting spells for 4 sec. Against non-players, also interrupts spellcasting and prevents any spell in that school from being cast for 4 sec."
PRIEST,defensive,Spirit of the Redeemer,215982,1,1,1,Defensives,1,Offensives,Instant,0 yards,,wow-priest-spirit-of-the-redeemer.png,wow-priest-spirit-of-the-redeemer.jpg,"Transforms your Spirit of Redemption into an active ability with a 2-minute cooldown. Its duration is reduced by 9 sec, and you no longer enter Spirit of Redemption upon dying.","Your Spirit of Redemption is now an active ability with a 2 minute cooldown, but the duration is reduced by 9 sec and you will no longer enter Spirit of Redemption upon dying."
PRIEST,externalDefensive,Void Shift,108968,1,1,1,Defensives,0,,Instant,40 yards,5 minutes,wow-priest-void-shift.png,wow-priest-void-shift.jpg,"Swaps health percentages with an ally. If either has less than 25% health, their percentage is increased to 25%.",Swap health percentages with your ally. Increases the lower health percentage of the two to 25% if below that amount.
ROGUE,cc,Blind,2094,1,1,1,Crowd Control,0,,Instant,15 yards,2 minutes,wow-rogue-blind.png,wow-rogue-blind.jpg,"Blinds the target, causing it to wander disoriented for 1 min. Damage will interrupt the effect.","Blinds the target, causing it to wander disoriented for 1 min. Damage will interrupt the effect. Limit 1."
ROGUE,defensive,Cheat Death,31230,1,1,0,,0,,Instant,0 yards,,wow-rogue-cheat-death.png,wow-rogue-cheat-death.jpg,"Fatal attacks reduce you to 7% health instead of killing you. For 3 sec afterward, you take 85% reduced damage. Can only happen once every 6 min.","Fatal attacks instead reduce you to 7% of your maximum health. For 3 sec afterward, you take 85% reduced damage. Cannot trigger more often than once per 6 min."
ROGUE,defensive,Cloak of Shadows,31224,1,1,1,Defensives,0,,Instant,0 yards,2 minutes,wow-rogue-cloak-of-shadows.png,wow-rogue-cloak-of-shadows.jpg,Grants magic immunity and instantly removes all harmful spell effects. You resist harmful spells for 5 sec.,"Provides a moment of magic immunity, instantly removing all harmful spell effects. The cloak lingers, causing you to resist harmful spells for 5 sec."
ROGUE,offensive,Deathmark,360194,1,0,0,,1,Offensives,Instant,5 yards,2 minutes,wow-rogue-deathmark.png,wow-rogue-deathmark.jpg,"Carves a deathmark into an enemy, dealing Bleed damage over 16 sec. While marked, your Garrote, Rupture, and Lethal poisons on the target are duplicated at full damage.","Carve a deathmark into an enemy, dealing (320% of Attack power) Bleed damage over 16 sec. While marked your Garrote, Rupture, and Lethal poisons applied to the target are duplicated, dealing 100% of normal damage."
ROGUE,defensive,Evasion,5277,1,1,1,Defensives,0,,Instant,0 yards,2 minutes,wow-rogue-evasion.png,wow-rogue-evasion.jpg,Increases your dodge chance to 100% for 10 sec.,Increases your dodge chance by 100% for 10 sec.
ROGUE,offensive,Flagellation,384631,0,0,0,,1,Offensives,Instant,5 yards,1.5 minutes,wow-rogue-flagellation.png,wow-rogue-flagellation.jpg,"Lashes the target for Shadow damage, causing each combo point spent within 12 sec to deal additional damage. Dealing damage with Flagellation increases your Mastery, persisting 12 sec after the effect ends.","Lash the target for (60% of Attack power) Shadow damage, causing each combo point spent within 12 sec to lash for an additional (12. 1% of Attack power) . Dealing damage with Flagellation increases your Mastery by (1 * $mas) %, persisting 12 sec after their torment fades."
ROGUE,offensive,Ghostly Strike,196937,0,0,0,,1,Offensives,Instant,5 yards,1.5 minutes,wow-rogue-ghostly-strike.png,wow-rogue-ghostly-strike.jpg,"Strikes an enemy, dealing Physical damage and causing them to take 15% increased damage from your abilities for 12 sec. Awards 1 combo point.","Strikes an enemy, dealing (232. 32% of Attack power) Physical damage and causing the target to take 15% increased damage from your abilities for 12 sec. Awards 1 combo point."
ROGUE,interrupt,Kick,1766,1,1,1,Interrupts,0,,Instant,5 yards,15 seconds,wow-rogue-kick.png,wow-rogue-kick.jpg,Interrupts spellcasting and prevents spells from the same school for 3 sec.,A quick kick that interrupts spellcasting and prevents any spell in that school from being cast for 3 sec.
ROGUE,cc,Kidney Shot,408,0,1,1,Crowd Control,0,,Instant,5 yards,30 seconds,wow-rogue-kidney-shot.png,wow-rogue-kidney-shot.jpg,"Finishing move that stuns the target. Duration increases with combo points, up to 8 sec:   | - 1 point: 4 sec   | - 2 points: 5 sec   | - 3 points: 6 sec   | - 4 points: 7 sec   | - 5 points: 8 sec","Finishing move that stuns the target. Lasts longer per combo point, up to 8 sec:   1 point : 4 second   2 points: 5 seconds   3 points: 6 seconds   4 points: 7 seconds   5 points: 8 seconds"
ROGUE,offensive,Kingsbane,385627,0,0,0,,1,Offensives,Instant,5 yards,1 minute,wow-rogue-kingsbane.png,wow-rogue-kingsbane.jpg,"Injects a lethal poison into your target, dealing Nature damage instantly and additional damage over 14 sec. Damage increases by 20% each time you apply Lethal Poison, up to 1000%. Awards 1 combo point.","Release a lethal poison from your weapons and inject it into your target, dealing (172. 81% of Attack power) Nature damage instantly and an additional (203% of Attack power) Nature damage over 14 sec. Each time you apply a Lethal Poison to a target affected by Kingsbane, Kingsbane damage increases by 20%, up to 1000%. Awards 1 combo points."
ROGUE,offensive,Secret Technique,280719,0,0,0,,1,Offensives,Instant,5 yards,1 minute,wow-rogue-secret-technique.png,wow-rogue-secret-technique.jpg,"Finishing move that deals Physical damage to the primary target and reduced damage to nearby enemies. Damage increases with more combo points, and cooldown is reduced by 1 sec for each combo point spent.","Finishing move that creates shadow clones of yourself. You and your shadow clones each perform a piercing attack on all enemies near your target, dealing Physical damage to the primary target and reduced damage to other targets.   1 point  : [(20% of Attack power) * 1 * 3] total damage   2 points: [(20% of Attack power) * 2 * 3] total damage   3 points: [(20% of Attack power) * 3 * 3] total damage   4 points: [(20% of Attack power) * 4 * 3] total damage   5 points: [(20% of Attack power) * 5 * 3] total damage [  6 points: [(20% of Attack power) * 6 * 3] total damage] [  7 points: [(20% of Attack power) * 7 * 3] total damage] Cooldown is reduced by 1 sec for every combo point you spend."
ROGUE,offensive,Shadow Blades,121471,1,0,0,,1,Offensives,Instant,0 yards,1.5 minutes,wow-rogue-shadow-blades.png,wow-rogue-shadow-blades.jpg,"Empowers your weapons, making attacks deal 20% additional Shadow damage and causing combo point generating abilities to generate full combo points for 16 sec.","Draws upon surrounding shadows to empower your weapons, causing your attacks to deal 20% additional damage as Shadow and causing your combo point generating abilities to generate full combo points for 16 sec."
ROGUE,offensive,Shadow Dance,185313,0,0,0,,1,Offensives,Instant,0 yards,6 seconds,wow-rogue-shadow-dance.png,wow-rogue-shadow-dance.jpg,Grants the use of all Stealth abilities and benefits of Stealth for 6 sec. Effect is not broken by damage or attacking.,Allows use of all Stealth abilities and grants all the combat benefits of Stealth for 6 sec. Effect not broken from taking damage or attacking.
ROGUE,cc,Shadowy Duel,207736,1,1,0,,0,,Instant,5 yards,2 minutes,wow-rogue-shadowy-duel.png,wow-rogue-shadowy-duel.jpg,"You and your target are removed from view for 5 sec, allowing use of Stealth-based abilities.","You lock your target into a duel contained in the shadows, removing both of you from the eyes of onlookers for 5 sec. Allows access to Stealth-based abilities."
ROGUE,cc,Smoke Bomb,212182,1,1,0,,0,,Instant,0 yards,3 minutes,wow-rogue-smoke-bomb.png,wow-rogue-smoke-bomb.jpg,"Creates a smoke cloud in an 8-yard radius around the Rogue for 5 sec, making enemies unable to target into or out of it.",Creates a cloud of thick smoke in an 8 yard radius around the Rogue for 5 sec. Enemies are unable to target into or out of the smoke cloud.
ROGUE,cc,Smoke Bomb,359053,1,1,0,,0,,Instant,0 yards,2 minutes,wow-rogue-smoke-bomb.png,wow-rogue-smoke-bomb.jpg,"Creates a cloud of thick smoke in an 8 yard radius around you for 5 sec, preventing enemies from targeting into or out of the smoke cloud.",Creates a cloud of thick smoke in an 8 yard radius around the Rogue for 5 sec. Enemies are unable to target into or out of the smoke cloud.
ROGUE,defensive,Vanish,1856,1,1,1,Defensives,0,,Instant,0 yards,1 second,wow-rogue-vanish.png,wow-rogue-vanish.jpg,"Allows you to enter stealth while in combat. For the first 3 sec, damage and harmful effects will not break stealth. Also removes movement impairing effects.","Allows you to vanish from sight, entering stealth while in combat. For the first 3 sec after vanishing, damage and harmful effects received will not break stealth. Also breaks movement impairing effects."
SHAMAN,heal,Ascendance,114052,1,1,0,,0,,Instant,0 yards,3 minutes,wow-shaman-ascendance.png,wow-shaman-ascendance.jpg,"Transform into a Water Ascendant, duplicating all healing you deal at 70% effectiveness for 15 sec. Immediately heals and evenly distributes healing among allies within 40 yds.","Transform into a Water Ascendant, duplicating all healing you deal at 70% effectiveness for 15 sec and immediately healing for (876% of Spell power) . Ascendant healing is distributed evenly among allies within 40 yds."
SHAMAN,defensive,Astral Shift,108271,1,1,1,Defensives,0,,Instant,0 yards,2 minutes,wow-shaman-astral-shift.png,wow-shaman-astral-shift.jpg,Take 40% less damage for 12 sec.,"Shift partially into the elemental planes, taking 40% less damage for 12 sec."
SHAMAN,offensive,Bloodlust,2825,0,0,0,,1,Offensives,Instant,0 yards,5 minutes,wow-shaman-bloodlust.png,wow-shaman-bloodlust.jpg,"Increases haste by 30% for all party and raid members for 40 sec. Allies will become Sated, preventing benefit from Bloodlust or Time Warp for 10 min.",Increases haste by 30% for all party and raid members for 40 sec. Allies receiving this effect will become Sated and unable to benefit from Bloodlust or Time Warp again for 10 min.
SHAMAN,immunity,Burrow,409293,1,1,1,Defensives,0,,Instant,0 yards,2 minutes,wow-shaman-burrow.png,wow-shaman-burrow.jpg,"Burrow beneath the ground, becoming unattackable, removing movement impairing effects, and increasing your movement speed by 50% for 5 sec. When the effect ends, enemies within 6 yards are knocked into the air and take Physical damage.","Burrow beneath the ground, becoming unattackable, removing movement impairing effects, and increasing your movement speed by 50% for 5 sec. When the effect ends, enemies within 6 yards are knocked in the air and take [Spell power * 6. 6 * (1 + Versatility)] Physical damage."
SHAMAN,dispel,Cleanse Spirit,51886,0,1,0,,0,,Instant,40 yards,8 seconds,wow-shaman-cleanse-spirit.png,wow-shaman-cleanse-spirit.jpg,Removes all Curse effects from a friendly target.,Removes all Curse effects from a friendly target.
SHAMAN,offensive,Doom Winds,384352,0,0,0,,1,Offensives,Instant,0 yards,1 minute,wow-shaman-doom-winds.png,wow-shaman-doom-winds.jpg,"Creates a storm around you, dealing Stormstrike damage every 1 sec to nearby enemies for 8 sec. Increases your chance to activate Windfury Weapon by 200% and its damage by 10%.","Unleash a devastating storm around yourself, dealing (74. 75% of Attack power) Stormstrike damage every 1 sec to nearby enemies for 8 sec. Increases your chance to activate Windfury Weapon by 200%, and the damage of Windfury Weapon by 10%."
SHAMAN,raidDefensive,Earthen Wall Totem,198838,1,1,0,,0,,Instant,40 yards,1 minute,wow-shaman-earthen-wall-totem.png,wow-shaman-earthen-wall-totem.jpg,Summons a totem at the target location with health based on 60% of your total health for 15 sec. Each attack against allies within 11.5 yards of the totem redirects 35% of the damage to the totem.,Summons a totem at the target location with (60 * Total health / 100) health for 15 sec. (35 * Spell power / 100) damage from each attack against allies within [Totemic Focus: 11. 5 / 10] yards of the totem is redirected to the totem.
SHAMAN,offensive,Feral Spirit,51533,0,0,0,,1,Offensives,Instant,30 yards,1.5 minutes,wow-shaman-feral-spirit.png,wow-shaman-feral-spirit.jpg,"Summons two Elemental Spirits that assist you in battle for 15 sec, immune to movement-impairing effects. Each spirit increases your Fire, Frost, or Nature damage by 20% (or Physical damage by 15%). Generates one stack of Maelstrom Weapon immediately and one stack every 3 sec for 15 sec.","Summons two [Elemental Spirits: Elemental] Spirit [Glyph of Spirit Raptors: Raptors / Wolves] that aid you in battle for 15 sec. They are immune to movement-impairing effects, and each [Elemental Spirits: Elemental] Feral Spirit summoned grants you [Elemental Spirits: 20% / 15%] increased [Elemental Spirits: Fire, Frost, or Nature / Physical] damage dealt by your abilities. Feral Spirit generates one stack of Maelstrom Weapon immediately, and one stack every 3 sec for 15 sec."
SHAMAN,counterCC,Grounding Totem,204336,1,1,0,,0,,Instant,0 yards,30 seconds,wow-shaman-grounding-totem.png,wow-shaman-grounding-totem.jpg,Summons a totem at your feet that redirects all harmful single-target spells cast within 30 yards on a nearby party or raid member to itself for 3 sec.,Summons a totem at your feet that will redirect all harmful spells cast within 30 yards on a nearby party or raid member to itself. Will not redirect area of effect spells. Lasts 3 sec.
SHAMAN,raidDefensive,Healing Tide Totem,108280,1,1,0,,0,,Instant,0 yards,3 minutes,wow-shaman-healing-tide-totem.png,wow-shaman-healing-tide-totem.jpg,"Summons a totem for 10 sec that pulses every 2 sec, healing all party or raid members within 40 yards. Healing is reduced beyond 5 targets.","Summons a totem at your feet for 10 sec, which pulses every 2 sec, healing all party or raid members within 40 yards for (175% of Spell power) . Healing reduced beyond 5 targets."
SHAMAN,cc,Hex,51514,0,1,0,,0,,1.7 seconds,30 yards,30 seconds,wow-shaman-hex.png,wow-shaman-hex.jpg,"Transforms an enemy Humanoid or Beast into a frog for 1 min, incapacitating them and preventing attacks or spellcasting. Damage may cancel the effect. Limit 1.","Transforms the enemy into a frog for 1 min. While hexed, the victim is incapacitated, and cannot attack or cast spells. Damage may cancel the effect. Limit 1. Only works on Humanoids and Beasts."
SHAMAN,cc,Lightning Lasso,305483,1,1,1,Crowd Control,0,,Instant,20 yards,45 seconds,wow-shaman-lightning-lasso.png,wow-shaman-lightning-lasso.jpg,Stuns the target and deals Nature damage over 5 sec while the target is lassoed. Can move while channeling.,"Grips the target in lightning, stunning and dealing (700% of Spell power) Nature damage over 5 sec while the target is lassoed. Can move while channeling."
SHAMAN,offensive,Primordial Wave,375982,0,0,0,,1,Offensives,Instant,40 yards,30 second,wow-shaman-primordial-wave.png,wow-shaman-primordial-wave.jpg,"Enhancement: Blast your target with Primordial Wave, dealing Elemental damage and applying Flame Shock. Your next Lightning Bolt hits all targets affected by Flame Shock for 175% damage. |  | Elemental: Blast your target with Primordial Wave, dealing Elemental damage, applying Flame Shock, and granting Lava Surge. Your next Lava Burst hits all targets affected by Flame Shock for 50% damage.","EnhancementBlast your target with a Primordial Wave, dealing (65% of Spell power) Elemental damage and applying Flame Shock to them. Your next Lightning Bolt will also hit all targets affected by your Flame Shock for 175% of normal damage. ElementalBlast your target with a Primordial Wave, dealing (65% of Spell power) Elemental damage, applying Flame Shock to them, and granting you Lava Surge. Your next Lava Burst will also hit all targets affected by your Flame Shock for 50% of normal damage."
SHAMAN,dispel,Purify Spirit,77130,0,1,0,,0,,Instant,40 yards,8 seconds,wow-shaman-purify-spirit.png,wow-shaman-purify-spirit.jpg,"Removes all Magic (and Curse, if Improved Purify Spirit is active) effects from a friendly target.",Removes all Magic [Improved Purify Spirit: and Curse] effects from a friendly target.
SHAMAN,raidDefensive,Spirit Link Totem,98008,1,1,1,Defensives,0,,Instant,40 yards,3 minutes,wow-shaman-spirit-link-totem.png,wow-shaman-spirit-link-totem.jpg,"Summons a totem at the target location for 6 sec, reducing damage taken by all party and raid members within 10 yards by 10%. Health of all affected players is redistributed evenly every second.","Summons a totem at the target location for 6 sec, which reduces damage taken by all party and raid members within 10 yards by 10%. Immediately and every 1 sec, the health of all affected players is redistributed evenly."
SHAMAN,freedom,Spirit Walk,58875,1,1,0,,0,,Instant,0 yards,1 minute,wow-shaman-spirit-walk.png,wow-shaman-spirit-walk.jpg,Removes all movement impairing effects and increases your movement speed by 60% for 8 sec.,Removes all movement impairing effects and increases your movement speed by 60% for 8 sec.
SHAMAN,defensive,Stone Bulwark Totem,108270,0,1,0,,0,,Instant,0 yards,3 minutes,wow-shaman-stone-bulwark-totem.png,wow-shaman-stone-bulwark-totem.jpg,Summons a totem that grants you an absorb shield for 15 sec and additional absorb every 5 sec for 30 sec.,"Summons a totem at your feet that grants you an absorb shield preventing 0 damage for 15 sec, and an additional 0 every 5 sec for 30 sec."
SHAMAN,offensive,Stormkeeper,191634,0,0,0,,1,Offensives,1.5 seconds,0 yards,1 minute,wow-shaman-stormkeeper.png,wow-shaman-stormkeeper.jpg,"Your next 2 Lightning Bolts deal 150% more damage and are instant cast, along with your next 2 Lightning Bolts or Chain Lightnings triggering an Elemental Overload on every target.","Charge yourself with lightning, causing your next 2 Lightning Bolts to deal 150% more damage, and also causes your next 2 Lightning Bolts or Chain Lightnings to be instant cast and trigger an Elemental Overload on every target."
