class,type,name,spellID,omniCDDefault,skillCappedDefaults,OmniBar,OmniBarType,WeakAura,WeakAuraType,castTime,range,cooldown,iconUrl,screenshotUrl,description
SHAMAN,cc,Lightning Lasso,305483,1,1,1,Crowd Control,0,,Instant,20 yards,45 seconds,wow-shaman-lightning-lasso.png,wow-shaman-lightning-lasso.jpg,Grips the target in lightning; stunning and dealing (700% of Spell power) Nature damage over 5 sec while the target is lassoed. Can move while channeling.
SHAMAN,offensive,Primordial Wave,375982,0,0,0,,1,Offensives,Instant,40 yards,30 second,wow-shaman-primordial-wave.png,wow-shaman-primordial-wave.jpg,EnhancementBlast your target with a Primordial Wave; dealing (65% of Spell power) Elemental damage and applying Flame Shock to them.Your next Lightning Bolt will also hit all targets affected by your Flame Shock for 175% of normal damage. ElementalBlast your target with a Primordial Wave; dealing (65% of Spell power) Elemental damage; applying Flame Shock to them; and granting you Lava Surge.Your next Lava Burst will also hit all targets affected by your Flame Shock for 50% of normal damage.
SHAMAN,dispel,Purify Spirit,77130,0,1,0,,0,,Instant,40 yards,,wow-shaman-purify-spirit.png,wow-shaman-purify-spirit.jpg,Removes all Magic[Improved Purify Spirit: and Curse] effects from a friendly target.
SHAMAN,raidDefensive,Spirit Link Totem,98008,1,1,1,Defensives,0,,Instant,40 yards,,wow-shaman-spirit-link-totem.png,wow-shaman-spirit-link-totem.jpg,Summons a totem at the target location for 6 sec; which reduces damage taken by all party and raid members within 10 yards by 10%. Immediately and every 1 sec; the health of all affected players is redistributed evenly.
SHAMAN,freedom,Spirit Walk,58875,1,1,0,,0,,Instant,0 yards,1 minute,wow-shaman-spirit-walk.png,wow-shaman-spirit-walk.jpg,Removes all movement impairing effects and increases the movement speed of you and your Spirit Wolves by 60% for 15 sec.
SHAMAN,defensive,Stone Bulwark Totem,108270,0,1,0,,0,,Instant,0 yards,3 minutes,wow-shaman-stone-bulwark-totem.png,wow-shaman-stone-bulwark-totem.jpg,Summons a totem at your feet that grants you an absorb shield preventing 0 damage for 15 sec; and an additional 0 every 5 sec for 30 sec.
SHAMAN,offensive,Stormkeeper,191634,0,0,0,,1,Offensives,1.5 seconds,0 yards,1 minute,wow-shaman-stormkeeper.png,wow-shaman-stormkeeper.jpg,Charge yourself with lightning; causing your next 2 Lightning Bolts to deal 150% more damage; and also causes your next 2 Lightning Bolts or Chain Lightnings to be instant cast and trigger an Elemental Overload on every target.
SHAMAN,counterCC,Tremor Totem,8143,1,1,0,,0,,Instant,0 yards,1 minute,wow-shaman-tremor-totem.png,wow-shaman-tremor-totem.jpg,Summons a totem at your feet that shakes the ground around it for 10 sec; removing Fear; Charm and Sleep effects from party and raid members within 30 yards.
SHAMAN,interrupt,Wind Shear,57994,1,1,1,Interrupts,0,,Instant,30 yards,12 seconds,wow-shaman-wind-shear.png,wow-shaman-wind-shear.jpg,Instantly blasts the target with a gust of wind; causing no damage but interrupting spellcasting and preventing any spell in that school from being cast for 2 sec. Also lowers your threat; making the enemy less likely to attack you.
WARLOCK,offensive,Amplify Curse,328774,0,0,0,,1,Offensives,Instant,0 yards,1 minute,wow-warlock-amplify-curse.png,wow-warlock-amplify-curse.jpg,Your next Curse of Exhaustion; Curse of Tongues or Curse of Weakness cast within 15 sec is amplified.Curse of ExhaustionReduces the target's movement speed by an additional 20%.Curse of TonguesIncreases casting time by an additional 40%.Curse of WeaknessEnemy is unable to critically strike.
WARLOCK,interrupt,Command Demon,119898,1,1,1,Interrupts,0,,Instant,0 yards,,wow-warlock-command-demon.png,wow-warlock-command-demon.jpg,Commands your demon to perform its most powerful ability. This spell will transform based on your active pet. [ Demonology: Felguard: Axe Toss]Felhunter: Spell LockVoidwalker: Shadow BulwarkIncubus/Succubus: SeductionImp: Singe Magic
WARLOCK,defensive,Dark Pact,108416,1,1,1,Defensives,0,,Instant,0 yards,1 minute,wow-warlock-dark-pact.png,wow-warlock-dark-pact.jpg,Sacrifices 20% of your current health to shield you for 200% of the sacrificed health plus an additional (Spell power * 2.5) for 20 sec. Usable while suffering from control impairing effects.
WARLOCK,movement,Demonic Circle: Teleport,48020,1,1,1,Defensives,0,,Instant,40 yards,30 seconds,wow-warlock-demonic-circle-teleport.png,wow-warlock-demonic-circle-teleport.jpg,Teleports you to your Demonic Circle and removes all snare effects.
WARLOCK,heal,Demonic Healthstone,452930,0,1,1,Defensives,0,,Instant,0 yards,1 minute,wow-warlock-demonic-healthstone.png,wow-warlock-demonic-healthstone.jpg,Instantly restores 25% health [Empowered Healthstone: plus an additional 30% over 6 sec / .]
WARLOCK,interrupt,Grimoire: Felguard,111898,1,1,0,,0,,Instant,40 yards,2 minutes,wow-warlock-grimoire-felguard.png,wow-warlock-grimoire-felguard.jpg,Summons a Felguard who attacks the target for 17 sec that deals 125% increased damage.This Felguard will stun and interrupt their target when summoned.
WARLOCK,aoeCC,Howl of Terror,5484,1,1,1,Crowd Control,0,,Instant,0 yards,40 seconds,wow-warlock-howl-of-terror.png,wow-warlock-howl-of-terror.jpg,Let loose a terrifying howl; causing 5 enemies within 10 yds to flee in fear; disorienting them for 20 sec. Damage may cancel the effect.
WARLOCK,offensive,Malevolence,442726,0,0,0,,1,Offensives,Instant,0 yards,1 minute,wow-warlock-malevolence.png,wow-warlock-malevolence.jpg,Dark magic erupts from you and corrupts your soul for 20 sec; causing enemies suffering from your Wither to take (333.029% of Spell power) Shadowflame damage and increase its stack count by 6.While corrupted your Haste is increased by 8% and spending Soul Shards on damaging spells grants 1 additional stack of Wither.
WARLOCK,cc,Mortal Coil,6789,1,1,1,Crowd Control,0,,Instant,20 yards,45 seconds,wow-warlock-mortal-coil.png,wow-warlock-mortal-coil.jpg,Horrifies an enemy target into fleeing; incapacitating for 3 sec and healing you for 20% of maximum health.
WARLOCK,offensive,Summon Demonic Tyrant,265187,1,0,0,,1,Offensives,2 seconds,40 yards,1 minute,wow-warlock-summon-demonic-tyrant.png,wow-warlock-summon-demonic-tyrant.jpg,Summon a Demonic Tyrant to increase the duration of your Dreadstalkers; Vilefiend; Felguard; and up to 10 of your Wild Imps by 15 sec. Your Demonic Tyrant increases the damage of affected demons by 15%; while damaging your target.[Soulbound Tyrant: Generates 0 Soul Shards.]
WARLOCK,defensive,Unending Resolve,104773,1,1,1,Defensives,0,,Instant,0 yards,3 minutes,wow-warlock-unending-resolve.png,wow-warlock-unending-resolve.jpg,Hardens your skin; reducing all damage you take by 25% and granting immunity to interrupt; silence; and pushback effects for 8 sec.
WARRIOR,offensive,Avatar,107574,1,0,0,,1,Offensives,Instant,0 yards,1.5 minutes,wow-warrior-avatar.png,wow-warrior-avatar.jpg,Transform into a colossus for 20 sec; causing you to deal 20% increased damage and removing all roots and snares.Generates 10 Rage.
WARRIOR,counterCC,Berserker Shout,384100,1,1,0,,0,,Instant,0 yards,1 minute,wow-warrior-berserker-shout.png,wow-warrior-berserker-shout.jpg,Go berserk; removing and granting immunity to Fear; Sap; and Incapacitate effects for 6 sec.Also remove fear effects from group members within 12 yds.
WARRIOR,offensive,Colossus Smash,167105,0,0,0,,1,Offensives,Instant,5 yards,45 seconds,wow-warrior-colossus-smash.png,wow-warrior-colossus-smash.jpg,Smashes the enemy's armor; dealing (306.263% of Attack power) Physical damage; and increasing damage you deal to them by 30% for 10 sec.
WARRIOR,defensive,Die by the Sword,118038,1,1,1,Defensives,0,,Instant,0 yards,2 minutes,wow-warrior-die-by-the-sword.png,wow-warrior-die-by-the-sword.jpg,Increases your parry chance by 100% and reduces all damage you take by 30% for 8 sec.
WARRIOR,defensive,Enraged Regeneration,184364,1,1,1,Defensives,0,,Instant,0 yards,2 minutes,wow-warrior-enraged-regeneration.png,wow-warrior-enraged-regeneration.jpg,Reduces damage taken by 30%; and Bloodthirst restores an additional 20% health. Usable while stunned or incapacitated. Lasts 8 sec.
WARRIOR,counterCC,Intervene,3411,0,1,1,Defensives,0,,Instant,25 yards,1.5 seconds,wow-warrior-intervene.png,wow-warrior-intervene.jpg,Run at high speed toward an ally; intercepting all melee and ranged attacks against them for 6 sec while they remain within 10 yds.
WARRIOR,aoeCC,Intimidating Shout,5246,1,1,1,Crowd Control,0,,Instant,8 yards,1.5 minutes,wow-warrior-intimidating-shout.png,wow-warrior-intimidating-shout.jpg,[Menace: Causes the targeted enemy and up to 5 additional enemies within 8 yards to cower in fear / Causes the targeted enemy to cower in fear; and up to 5 additional enemies within 8 yards to flee.] Targets are disoriented for 8 sec.
WARRIOR,interrupt,Pummel,6552,1,1,1,Interrupts,0,,Instant,5 yards,15 seconds,wow-warrior-pummel.png,wow-warrior-pummel.jpg,Pummels the target; interrupting spellcasting and preventing any spell in that school from being cast for 3 sec.
WARRIOR,raidDefensive,Rallying Cry,97462,1,1,1,Defensives,0,,Instant,0 yards,3 minutes,wow-warrior-rallying-cry.png,wow-warrior-rallying-cry.jpg,Lets loose a rallying cry; granting all party or raid members within 40 yards 10% temporary and maximum health for 10 sec.
WARRIOR,offensive,Recklessness,1719,1,0,0,,1,Offensives,Instant,0 yards,1.5 minutes,wow-warrior-recklessness.png,wow-warrior-recklessness.jpg,Go berserk; increasing all Rage generation by 100% and granting your abilities 20% increased critical strike chance for 12 sec.
WARRIOR,aoeCC,Shockwave,46968,0,1,0,,0,,Instant,0 yards,40 seconds,wow-warrior-shockwave.png,wow-warrior-shockwave.jpg,Sends a wave of force in front of the warrior; causing (75 / 100 * Attack power) damage (based on attack power) and stunning all enemy targets within 10 yards in a frontal cone for 4 sec.
WARRIOR,cc,Storm Bolt,107570,1,1,1,Crowd Control,0,,Instant,20 yards,30 seconds,wow-warrior-storm-bolt.png,wow-warrior-storm-bolt.jpg,Hurls your weapon at an enemy; causing (28.5% of Attack power) Physical damage and stunning for 4 sec.[Storm Bolts: Also hits 2 additional nearby targets; stunning for 2 sec]
WARRIOR,offensive,Thunderous Roar,384318,0,0,0,,1,Offensives,Instant,0 yards,1.5 minutes,wow-warrior-thunderous-roar.png,wow-warrior-thunderous-roar.jpg,Roar explosively; dealing (250.56% of Attack power) Physical damage to enemies within 12 yds and cause them to bleed for (250.56% of Attack power) physical damage over 8 sec. Deals reduced damage beyond 5 targets.
WARRIOR,counterCC,War Banner,236320,0,1,0,,0,,Instant,0 yards,1.5 minutes,wow-warrior-war-banner.png,wow-warrior-war-banner.jpg,You throw down a war banner at your feet; rallying your allies. Increases movement speed by 30% and reduces the duration of all incoming crowd control effects by 50% to all allies within 30 yards of the war banner. Lasts 15 sec.